FQDN,ASN,IP Address,FQDNS,Country_Code,Country_Name,Region_Code,Region_Name,City_Name,Latitude,Longitude,Metro_Code,Area_Code,Time_Zone,Continent_Code,Postal_Code,Isp_Name,Organization_Name,Domain,As_Number,Netspeed,User_Type,Accuracy_Radius,Country_Confidence,City_Confidence,Region_Confidence,Postal_Confidence
bigdepression.net,8560,87.106.24.200,DE,"[u'%5B.%5D.kjwre9fqwieluoi.info', u'10f6c.cash-ddt.net', u'11102.makemegood24.com', u'14929.makemegood24.com', u'15c92.makemegood24.com', u'16954.cash-ddt.net', u'1a95a.makemegood24.com', u'1b1a7.makemegood24.com', u'1b1b7.cash-ddt.net', u'1b9a6.makemegood24.com', u'1d1b2.cash-ddt.net', u'1f269.makemegood24.com', u'1fc992.makemegood24.com', u'1ff277.makemegood24.com', u'23fed.cash-ddt.net', u'23fed.makemegood24.com', u'242db.money-frn.net', u'24b95.makemegood24.com', u'25365.money-frn.net', u'264cb.cash-ddt.net', u'28b2f.makemegood24.com', u'2e526.makemegood24.com', u'2e630.money-frn.net', u'2e8b0.cash-ddt.net', u'2e8b0.makemegood24.com', u'30502.makemegood24.com', u'32e617.bmoney-frn.net', u'41ddb.cash-ddt.net', u'42db3.cash-ddt.net', u'42df2.money-frn.net', u'4c8bb.bmoney-frn.net', u'4e626.makemegood24.com', u'4ead9.cash-ddt.net', u'4eba4.money-frn.net', u'87-106-24-200.sinkhole.shadowserver.org', u'abakemegood24.com', u'acakemegood24.com', u'adakemegood24.com', u'aeakemegood24.com', u'anti-viral.us', u'ar-24.com', u'ba3xo56pa7bo.com', u'bcash-ddt.net', u'best-arts-2010.com', u'bonpyrrol.info', u'bpbrfectchoice1.com', u'bratanas.info', u'buynvf96.info', u'cash-ddt.net', u'casinoaffiliatepartners.net', u'd.robints.us', u'ddknet.biz', u'dfgdfgfdg.biz', u'etrn-bash.net', u'evcufcit.biz', u'eyjlw.lukki6nd2kdnc.info', u'f2bc.makemegood24.com', u'faka.biz', u'firstwolf.org', u'freeguard.biz', u'g1ikddcvns3sdsal.info', u'gloubergs.biz', u'h00k.info', u'hkukud123ncs.info', u'inform1ongung.info', u'kerisanter.biz', u'kjwre9fqwieluoi.info', u'kokosss.biz', u'krutahuli.info', u'kukutrustnet666.info', u'kukutrustnet777.info', u'kukutrustnet888.info', u'kukutrustnet987.info', u'lyalyabum.info', u'makemegood24.com', u'mky.hkukud123ncs.info', u'money-frn.net', u'mrkva.su', u'musah.info', u'norton-kaspersky.net', u'opqhxqmxmuwdqtx.biz', u'pares.biz', u'pvcox.biz', u'pvdiz.biz', u'pvsex.biz', u'quvpcxqpbvspdxk.biz', u'real-net-arts.com', u'samsgreatarts.com', u'sbapodremer.biz', u'snqed.hkukud123ncs.info', u'sorpkxihnkslrtqy.biz', u'super-tds.info', u'theypay.us', u'ultracreative-solutions.biz', u'vaznyjdomen.info', u'w.robints.us', u'wm.krutahuli.info', u'wm.lohotronschik.info', u'wm.vaznyjdomen.info', u'ww.robint.us', u'www.freeguard.biz', u'www.g1ikddcvns3sdsal.info', u'www.h7smcnr1wlsdn34fgv.info', u'www.hkukud123ncs.info', u'www.inform1ongung.info', u'www.kjwre9fqwieluoi.info', u'www.kukutrustnet.org', u'www.kukutrustnet666.info', u'www.kukutrustnet7.info', u'www.lukki6dnd2kdnc.info', u'www.lukki6nd2kdnc.info', u'www.shop86.biz', u'www.xaxaxaxa.info', u'yzfmav.com', u'zapaska.biz', u'zzk.imageshak.biz']",Germany,,,,51.0000,9.0000,,,Europe/Berlin,EU,,1&1 Internet AG,1&1 Internet AG,onlinehome-server.info,AS8560 1&1 Internet AG,Corporate,hosting,,99,,,
blackberrycluter.com,8560,74.208.164.166,US,"[u'%5B.%5D.kjwre9fqwieluoi.info', u'1053b.makemegood24.com', u'10f6c.cash-ddt.net', u'14929.makemegood24.com', u'17b45.makemegood24.com', u'1875b.money-frn.net', u'1a999.cash-ddt.net', u'1a9a8.money-frn.net', u'1b1b7.cash-ddt.net', u'1b1c6.money-frn.net', u'1c3dc.makemegood24.com', u'1d9666.cash-ddt.net', u'1f269.makemegood24.com', u'1fc992.makemegood24.com', u'23fed.cash-ddt.net', u'242db.money-frn.net', u'24b95.makemegood24.com', u'24b95.money-frn.net', u'261dd.money-frn.net', u'264f9.money-frn.net', u'28b2f.makemegood24.com', u'2e526.makemegood24.com', u'2e564.cash-ddt.net', u'2e8b0.cash-ddt.net', u'2e8c0.money-frn.net', u'2f358.makemegood24.com', u'30502.makemegood24.com', u'41414.makemegood24.com', u'42d84.makemegood24.com', u'42db3.cash-ddt.net', u'4ead9.cash-ddt.net', u'4eba4.money-frn.net', u'4f401.makemegood24.com', u'4f45f.cash-ddt.net', u'74-208-164-166.sinkhole.shadowserver.org', u'853c9e57.biz', u'abakemegood24.com', u'acakemegood24.com', u'adakemegood24.com', u'aeakemegood24.com', u'anti-viral.us', u'artmaza.mazafaka.biz', u'ba3xo56pa7bo.com', u'bddr-cash.net', u'best-arts-2010.com', u'blqn.hkukud123ncs.info', u'bonpyrrol.info', u'bpbrfectchoice1.com', u'bratanas.info', u'bxxxl-cash.net', u'cash-ddt.net', u'casinoaffiliatepartners.net', u'ccaah-ddt.net', u'dfgdfgfdg.biz', u'etrn-bash.net', u'eyjlw.lukki6nd2kdnc.info', u'f2bc.makemegood24.com', u'fcbkvip.com', u'firstwolf.org', u'fkwvfthi.biz', u'freeguard.biz', u'h00k.info', u'h7smcnrwlsdn34fgv.info', u'jcyjjkkx.info', u'kerisanter.biz', u'kjwre9fqwieluoi.info', u'krutahuli.info', u'kukutrustnet.org', u'kukutrustnet666.info', u'kukutrustnet777.info', u'kukutrustnet888.info', u'kukutrustnet987.info', u'loader-trf-test.net', u'lohotronschik.info', u'lukki6dnd2kdnc.info', u'lyalyabum.info', u'makemegood24.com', u'mky.hkukud123ncs.info', u'money-frn.net', u'mrkva.su', u'musah.info', u'newsgroupupdate.com', u'pedrodepako.biz', u'pvcox.biz', u'pvdiz.biz', u'pvsex.biz', u'qmsrnxuwnwfguqhw.biz', u'real-net-arts.com', u'realnetsupport.com', u'rtsysteminfo.com', u'samsgreatarts.com', u'sbapodremer.biz', u'sefergtrserfv.biz', u'softwaresupdates.info', u'space-sms.info', u'spl-trf-new.net', u'super-tds.info', u'tatoshko.biz', u'ultracreative-solutions.biz', u'umhtxtls.info', u'update.fcbkvip.com', u'vaznyjdomen.info', u'w.robints.us', u'web-exclusive.biz', u'wiqrj494.com', u'wm.lohotronschik.info', u'wm.vaznyjdomen.info', u'ww.robint.us', u'www.bigdepression.net', u'www.ferki.info', u'www.freeguard.biz', u'www.g1ikddcvns3sdsal.info', u'www.h7smcnr1wlsdn34fgv.info', u'www.hkukud123ncs.info', u'www.inform1ongung.info', u'www.kjwre9fqwieluoi.info', u'www.kukutrustnet.org', u'www.kukutrustnet666.info', u'www.kukutrustnet7.info', u'www.kukutrustnet777.info', u'www.lukki6dnd2kdnc.info', u'www.lukki6nd2kdnc.info', u'www.xaxaxaxa.info', u'yzfmav.com', u'zzk.imageshak.biz']",United States,PA,Pennsylvania,Wayne,40.0548,-75.4083,504,610,America/New_York,NA,19087,1&1 Internet,1&1 Internet,rmoov.com,AS8560 1&1 Internet AG,Corporate,hosting,534,99,20,60,10
blackberrycluter.com,8560,87.106.24.200,DE,"[u'%5B.%5D.kjwre9fqwieluoi.info', u'10f6c.cash-ddt.net', u'11102.makemegood24.com', u'14929.makemegood24.com', u'15c92.makemegood24.com', u'16954.cash-ddt.net', u'1a95a.makemegood24.com', u'1b1a7.makemegood24.com', u'1b1b7.cash-ddt.net', u'1b9a6.makemegood24.com', u'1d1b2.cash-ddt.net', u'1f269.makemegood24.com', u'1fc992.makemegood24.com', u'1ff277.makemegood24.com', u'23fed.cash-ddt.net', u'23fed.makemegood24.com', u'242db.money-frn.net', u'24b95.makemegood24.com', u'25365.money-frn.net', u'264cb.cash-ddt.net', u'28b2f.makemegood24.com', u'2e526.makemegood24.com', u'2e630.money-frn.net', u'2e8b0.cash-ddt.net', u'2e8b0.makemegood24.com', u'30502.makemegood24.com', u'32e617.bmoney-frn.net', u'41ddb.cash-ddt.net', u'42db3.cash-ddt.net', u'42df2.money-frn.net', u'4c8bb.bmoney-frn.net', u'4e626.makemegood24.com', u'4ead9.cash-ddt.net', u'4eba4.money-frn.net', u'87-106-24-200.sinkhole.shadowserver.org', u'abakemegood24.com', u'acakemegood24.com', u'adakemegood24.com', u'aeakemegood24.com', u'anti-viral.us', u'ar-24.com', u'ba3xo56pa7bo.com', u'bcash-ddt.net', u'best-arts-2010.com', u'bonpyrrol.info', u'bpbrfectchoice1.com', u'bratanas.info', u'buynvf96.info', u'cash-ddt.net', u'casinoaffiliatepartners.net', u'd.robints.us', u'ddknet.biz', u'dfgdfgfdg.biz', u'etrn-bash.net', u'evcufcit.biz', u'eyjlw.lukki6nd2kdnc.info', u'f2bc.makemegood24.com', u'faka.biz', u'firstwolf.org', u'freeguard.biz', u'g1ikddcvns3sdsal.info', u'gloubergs.biz', u'h00k.info', u'hkukud123ncs.info', u'inform1ongung.info', u'kerisanter.biz', u'kjwre9fqwieluoi.info', u'kokosss.biz', u'krutahuli.info', u'kukutrustnet666.info', u'kukutrustnet777.info', u'kukutrustnet888.info', u'kukutrustnet987.info', u'lyalyabum.info', u'makemegood24.com', u'mky.hkukud123ncs.info', u'money-frn.net', u'mrkva.su', u'musah.info', u'norton-kaspersky.net', u'opqhxqmxmuwdqtx.biz', u'pares.biz', u'pvcox.biz', u'pvdiz.biz', u'pvsex.biz', u'quvpcxqpbvspdxk.biz', u'real-net-arts.com', u'samsgreatarts.com', u'sbapodremer.biz', u'snqed.hkukud123ncs.info', u'sorpkxihnkslrtqy.biz', u'super-tds.info', u'theypay.us', u'ultracreative-solutions.biz', u'vaznyjdomen.info', u'w.robints.us', u'wm.krutahuli.info', u'wm.lohotronschik.info', u'wm.vaznyjdomen.info', u'ww.robint.us', u'www.freeguard.biz', u'www.g1ikddcvns3sdsal.info', u'www.h7smcnr1wlsdn34fgv.info', u'www.hkukud123ncs.info', u'www.inform1ongung.info', u'www.kjwre9fqwieluoi.info', u'www.kukutrustnet.org', u'www.kukutrustnet666.info', u'www.kukutrustnet7.info', u'www.lukki6dnd2kdnc.info', u'www.lukki6nd2kdnc.info', u'www.shop86.biz', u'www.xaxaxaxa.info', u'yzfmav.com', u'zapaska.biz', u'zzk.imageshak.biz']",Germany,,,,51.0000,9.0000,,,Europe/Berlin,EU,,1&1 Internet AG,1&1 Internet AG,onlinehome-server.info,AS8560 1&1 Internet AG,Corporate,hosting,,99,,,
blackberrycluter.com,8560,87.106.250.34,DE,"[u'%5B.%5D.kjwre9fqwieluoi.info', u'1053b.makemegood24.com', u'10f6c.cash-ddt.net', u'14929.makemegood24.com', u'152e1e.makemegood24.com', u'15c92.makemegood24.com', u'16954.cash-ddt.net', u'17b45.makemegood24.com', u'1875b.money-frn.net', u'1a95a.makemegood24.com', u'1a999.cash-ddt.net', u'1b1a7.makemegood24.com', u'1b1b7.cash-ddt.net', u'1b1c6.money-frn.net', u'1b9a6.makemegood24.com', u'1be69.makemegood24.com', u'1c3fa.makemegood24.com', u'1d1b2.cash-ddt.net', u'1d9666.cash-ddt.net', u'1fc59b.makemegood24.com', u'1fc992.makemegood24.com', u'1ff277.makemegood24.com', u'21dfe.money-frn.net', u'25365.cash-ddt.net', u'264ab.makemegood24.com', u'264cb.cash-ddt.net', u'2e564.cash-ddt.net', u'2e8b0.cash-ddt.net', u'2e8b0.makemegood24.com', u'2e8c0.money-frn.net', u'41414.makemegood24.com', u'42d84.makemegood24.com', u'4e626.makemegood24.com', u'4f401.makemegood24.com', u'4f45f.cash-ddt.net', u'5d556e.bmoney-frn.net', u'62e32.money-frn.net', u'abakemegood24.com', u'acakemegood24.com', u'adakemegood24.com', u'aeakemegood24.com', u'auqr.h7smcnrwlsdn34fgv.info', u'bclr-cash.net', u'best-arts-2010.com', u'bonpyrrol.info', u'bpbrfectchoice1.com', u'bratanas.info', u'btrn-cash.net', u'cash-ddt.net', u'casinoaffiliatepartners.net', u'ccaah-ddt.net', u'd.robints.us', u'd88d.makemegood24.com', u'ddknet.biz', u'dfgdfgfdg.biz', u'etrn-bash.net', u'faka.biz', u'firstwolf.org', u'freeguard.biz', u'fullmooninfo.com', u'gloubergs.biz', u'gyppv.lukki6nd2kdnc.info', u'h00k.info', u'h7smcnr1wlsdn34fgv.info', u'imageshak.biz', u'imncw.h7smcnrwlsdn34fgv.info', u'interfiumsen.com', u'jcyjjkkx.info', u'kinza.info', u'kjwre9fqwieluoi.info', u'kokosss.biz', u'krutahuli.info', u'kukutrustnet666.info', u'kukutrustnet7.info', u'kukutrustnet777.info', u'kukutrustnet888.info', u'kukutrustnet987.info', u'llhacjqk.info', u'lohotronschik.info', u'lukki6nd2kdnc.info', u'lyalyabum.info', u'makemegood24.com', u'money-frn.net', u'musah.info', u'opqhxqmxmuwdqtx.biz', u'pares.biz', u'psypolice.biz', u'pvcox.biz', u'pvdiz.biz', u'pvsex.biz', u'qshorthk.info', u'real-net-arts.com', u'robint.us', u'samsgreatarts.com', u'sbapodremer.biz', u'shop86.biz', u'sonificaton.com', u'space-sms.info', u'super-tds.info', u'ua-shop.biz', u'uhkic.hkukud123ncs.info', u'vaznyjdomen.info', u'w.robints.us', u'wbg-group.softsolutionbox.net', u'wiqrj494.com', u'wm.lohotronschik.info', u'wm.lyalyabum.info', u'wm.vaznyjdomen.info', u'ww.robint.us', u'www.d.robints.us', u'www.freeguard.biz', u'www.g1ikddcvns3sdsal.info', u'www.h7smcnr1wlsdn34fgv.info', u'www.hkukud123ncs.info', u'www.inform1ongung.info', u'www.kjwre9fqwieluoi.info', u'www.kukutrustnet.org', u'www.kukutrustnet666.info', u'www.kukutrustnet7.info', u'www.kukutrustnet777.info', u'www.lukki6dnd2kdnc.info', u'www.lukki6nd2kdnc.info', u'zapaska.biz']",Germany,,,,51.0000,9.0000,,,Europe/Berlin,EU,,1&1 Internet AG,1&1 Internet AG,onlinehome-server.info,AS8560 1&1 Internet AG,Corporate,hosting,,99,,,
blackberrycluter.com,8560,108.175.9.189,US,"[u'%5B.%5D.kjwre9fqwieluoi.info', u'1053b.makemegood24.com', u'11102.makemegood24.com', u'152e1e.makemegood24.com', u'15c92.makemegood24.com', u'16954.cash-ddt.net', u'1a95a.makemegood24.com', u'1a9a8.money-frn.net', u'1b1b7.cash-ddt.net', u'1be69.makemegood24.com', u'1d1b2.cash-ddt.net', u'1fc59b.makemegood24.com', u'1fe07.makemegood24.com', u'1ff277.makemegood24.com', u'24b95.cash-ddt.net', u'24b95.makemegood24.com', u'24b95.money-frn.net', u'25365.cash-ddt.net', u'25365.makemegood24.com', u'25365.money-frn.net', u'261dd.money-frn.net', u'264ab.makemegood24.com', u'264f9.money-frn.net', u'2e526.makemegood24.com', u'2e630.money-frn.net', u'2e8b0.makemegood24.com', u'2e8c0.money-frn.net', u'42df2.money-frn.net', u'4e626.makemegood24.com', u'4ead9.cash-ddt.net', u'4eba4.money-frn.net', u'4f45f.cash-ddt.net', u'5bc84.money-frn.net', u'623b7.makemegood24.com', u'853c9e57.biz', u'88you.biz', u'abakemegood24.com', u'acakemegood24.com', u'adakemegood24.com', u'aeakemegood24.com', u'ar-24.com', u'auqr.h7smcnrwlsdn34fgv.info', u'ba3xo56pa7bo.com', u'best-arts-2010.com', u'blqn.hkukud123ncs.info', u'bmoney-frn.net', u'bonpyrrol.info', u'bpbrfectchoice1.com', u'bratanas.info', u'cash-ddt.net', u'ccaah-ddt.net', u'dfgdfgfdg.biz', u'etrn-bash.net', u'evcufcit.biz', u'f2bc.makemegood24.com', u'firstwolf.org', u'fkwvfthi.biz', u'freeguard.biz', u'gloubergs.biz', u'grbitz.info', u'h00k.info', u'hkukud123ncs.info', u'inform1ongung.info', u'interfiumsen.com', u'kjwre9fqwieluoi.info', u'kokosss.biz', u'krutahuli.info', u'kukutrustnet777.info', u'kukutrustnet888.info', u'kukutrustnet987.info', u'loader-trf-test.net', u'lohotronschik.info', u'lukki6dnd2kdnc.info', u'lyalyabum.info', u'makemegood24.com', u'money-frn.net', u'musah.info', u'norton-kaspersky.net', u'oniw.hkukud123ncs.info', u'oreg.lukki6nd2kdnc.info', u'pares.biz', u'pedrodepako.biz', u'psypolice.biz', u'pvdiz.biz', u'qmsrnxuwnwfguqhw.biz', u'qshorthk.info', u'real-net-arts.com', u'samsgreatarts.com', u'sbapodremer.biz', u'sefergtrserfv.biz', u'sfl.hkukud123ncs.info', u'shop86.biz', u'snqed.hkukud123ncs.info', u'softwaresupdates.info', u'sonificaton.com', u'spa.rtsysteminfo.com', u'spl-trf-new.net', u'super-tds.info', u'tatoshko.biz', u'ua-shop.biz', u'uhkic.hkukud123ncs.info', u'ultracreative-solutions.biz', u'umhtxtls.info', u'vaznyjdomen.info', u'w.robints.us', u'wbg-group.softsolutionbox.net', u'wm.lyalyabum.info', u'wm.vaznyjdomen.info', u'ww.robint.us', u'www.freeguard.biz', u'www.g1ikddcvns3sdsal.info', u'www.h7smcnr1wlsdn34fgv.info', u'www.h7smcnrwlsdn34fgv.info', u'www.hkukud123ncs.info', u'www.inform1ongung.info', u'www.kjwre9fqwieluoi.info', u'www.kukutrustnet.org', u'www.kukutrustnet666.info', u'www.kukutrustnet7.info', u'www.lukki6dnd2kdnc.info', u'www.lukki6nd2kdnc.info', u'www.shop86.biz', u'www.xaxaxaxa.info', u'yzfmav.com', u'zapaska.biz']",United States,PA,Pennsylvania,Wayne,40.0548,-75.4083,504,610,America/New_York,NA,19087,1&1 Internet,1&1 Internet,onlinehome-server.com,AS8560 1&1 Internet AG,Corporate,hosting,534,99,20,60,10
